{
  "automated_checks": {
    "bundle_error_count": 0,
    "bundle_valid": true,
    "bundle_warning_count": 0,
    "ready_for_leaderboard_review": true
  },
  "bundle_path": "submission_bundle.json",
  "bundle_sha256": "ad4e2ff41796e55d2577fd6d056cae589e952c2d023ac1422186af146a72162a",
  "created_at": 1780242707.0,
  "decision": "needs_revision",
  "explanation_audit": {
    "case_count": 18,
    "correct_explanation_ready_rate": 1.0,
    "evidence_count": 18,
    "evidence_coverage": 1.0,
    "explanation_ready_count": 18,
    "explanation_ready_rate": 1.0,
    "rationale_count": 18,
    "rationale_coverage": 1.0
  },
  "notes": "Completed example review: the evidence chain is valid, but the placeholder all-none system needs substantive disclosure, case-specific reasoning, and limitations before leaderboard acceptance.",
  "overall_score": 11.11,
  "reviewer": "example-reviewer",
  "rubric": {
    "disclosure_quality": {
      "criterion": "Model, prompting, preprocessing, retrieval, postprocessing, training data, and runtime are disclosed.",
      "max_score": 2,
      "notes": "All disclosure fields are populated, but they describe a placeholder no-model system rather than a substantive implementation.",
      "score": 1
    },
    "evidence_quality": {
      "criterion": "Evidence quotes or references support the predicted labels without leaking expected labels.",
      "max_score": 2,
      "notes": "Evidence quotes are present, but the generic all-none rationale does not connect that evidence to each prediction.",
      "score": 1
    },
    "explanation_coverage": {
      "criterion": "Rationale and evidence fields cover enough cases for meaningful review.",
      "max_score": 2,
      "notes": "Rationale and evidence fields cover every case, but the rationale is identical rather than case-specific.",
      "score": 1
    },
    "limitations": {
      "criterion": "Known limitations, failure modes, and benchmark-use caveats are stated clearly.",
      "max_score": 2,
      "notes": "The packet identifies itself as an example, but it does not provide a substantive failure-mode analysis.",
      "score": 1
    },
    "reproducibility": {
      "criterion": "The bundle, report, hashes, suite identity, and commands are reproducible.",
      "max_score": 2,
      "notes": "Bundle, report, predictions, hashes, suite identity, and validation commands reproduce deterministically.",
      "score": 2
    },
    "score_integrity": {
      "criterion": "The reported score is backed by a valid report and no unexplained metric mismatch.",
      "max_score": 2,
      "notes": "The 11.11 score reproduces from the checked all-none predictions with no unexplained metric mismatch.",
      "score": 2
    }
  },
  "schema": "marked_bench.submission-review.v1",
  "submitter": "The Marked Bench Examples",
  "suite_hash": "07a2bb9c0e8356d1cdab98b5b1b35a3c8bd29beff695816dfb151dbb5f6d0d1f",
  "suite_id": "marked-bench-contradiction-multihop",
  "suite_version": "0.3.0",
  "summary": {
    "accept_recommendation_minimum": 9,
    "completed_dimensions": 6,
    "dimension_count": 6,
    "ready_for_decision": true,
    "recommendation": "needs_revision",
    "rubric_max": 12,
    "rubric_total": 8
  },
  "system_name": "ExampleExternalJsonl",
  "system_version": "demo-1.0"
}
